"Status","Start Time","Stop Time","Duration in ms","Parent Suite","Suite","Sub Suite","Test Class","Test Method","Name","Description"
"failed","Mon Jun 16 10:42:15 UTC 2025","Mon Jun 16 10:42:29 UTC 2025","13771","tests.test_cases.tests_ui","UI Signup","TestUISignup","","","New user successful signup",""
"failed","Mon Jun 16 10:42:00 UTC 2025","Mon Jun 16 10:42:07 UTC 2025","6656","tests.test_cases.tests_ui","UI Login","TestUICreateFirstOrganization","","","Create First Organization via UI",""
"passed","Mon Jun 16 10:41:00 UTC 2025","Mon Jun 16 10:41:01 UTC 2025","1442","tests.test_cases.tests_cli","CLI Login","TestCLILogin","","","User logs in to Apolo CLI with auth token and verifies login success",""
"passed","Mon Jun 16 10:42:10 UTC 2025","Mon Jun 16 10:42:14 UTC 2025","3695","tests.test_cases.tests_ui","UI Login","TestUILogin","","","New user successful login",""
"skipped","Mon Jun 16 10:41:06 UTC 2025","Mon Jun 16 10:41:10 UTC 2025","3930","tests.test_cases.tests_cli","CLI Organization Structure Setup","TestCLIOrganizationStructureSetup","","","User creates a first organization via CLI",""
"failed","Mon Jun 16 10:41:15 UTC 2025","Mon Jun 16 10:41:53 UTC 2025","38765","tests.test_cases.tests_e2e","Apolo CLI Hello World Job Verification","TestHelloWorldJob","","","Run Hello World Job and Validate UI and CLI Results",""
